team names,series number,filename,name,description,gender,attributes,uuid,hash
TEAM BEVEL,1,adewale-the-amebo,adewale the amebo,Adewale likes to be in everyone's business. ,Male,hair: bald; eyes: black; teeth: none; clothing: red; accessories: mask; expression: none; strength: powerful; weakness: curiosity,cad316c3-37f8-4b27-9f53-9d803bfcfee7,1182dbf40d21ee7d104314ceca02f2a63ce955385595839a074b18d1648f6ece
,2,alli-the-queeny,alli the queeny,Alli is an LGBT Stan.,Male,hair: bald; eyes: white; teeth: none; clothing: yellow; accessories: mask; expression: none; strength: powerful; weakness: none,a57ecda4-a26f-4e97-a757-e1800af39aab,ff88dab09f26251644d9599201bf9c34172986325238b53d89e364cb51a284d5
,3,aminat-the-snnobish,aminat the snnobish,Aminat never really wants to talk to anyone.,Female,hair: brown bun; eyes: none; teeth: none; clothing: yellow; accessories: glasses; expression: blank; strength: none; weakness: attitude,0e37ed0d-3e84-4f32-a91f-ec9c4ba8c7de,4fe7084de208bdf4b5744740fc082ec0727dee17c25ce55a1386f52995d050d1
,4,aminu-the-carpenter,aminu the carpenter,Aminu's hands are blessed; he makes the best furniture in the whole of Kano.,Male,hair: bald; eyes: blue; teeth: none; clothing: yellow; accessories: mask; expression: none; strength: powerful; weakness: none,4f30b751-96e7-40fe-97fd-e3d44973ff2f,379c5301dcad0d23cccf368043c747958e957f5619a38a2cb1fd5b8b1a46a19a
,5,chibuike-the-kudibag,chibuike the kudibag,Chibuike is too rich. Everyone wonders how he got it.,Male,hair: bald; eyes: black; teeth: none; clothing: blue; accessories: mask; expression: none; strength: hustler; weakness: none,5ce854f2-7ac1-46fd-b3fe-57583935d1e5,ec10a33274c8f0ec65270270e16d3bdc513223746e236e6e6423911bb14dd22d
,6,chidinma-the-model,chidinma the model,From Paris' runways; to London's streets; she's always in demand.,Female,hair: brown hair; eyes: none; teeth: none; clothing: multicolored; accessories: glasses; expression: none; strength: hardworking; weakness: none,c98db72e-49ac-4ca6-89d5-e00f5fbbcc45,bd91f779a2acebc74d8cd83d202382eb2093c37932553bc1e3a64c39319f19b2
,7,chioma-pretty- girl,chioma pretty girl,Chioma's face card is a 100.,Female,hair: dreads; eyes: none; teeth: none; clothing: multicolored; accessories: glasses; expression: none; strength: none; weakness: none,182ea888-a85b-42ca-ad73-ed4f8f9aa5c7,8cfa47f716de009b9fe5b68fbd2399177d2c65aadedebe40c1a58574f8b7ed36
,8,damilare-the-handsome,damilare the handsome,He's a fine boy; proper eye candy. ,Male,hair: bald; eyes: white; teeth: none; clothing: yellow; accessories: mask; expression: none; strength: none; weakness: none,27eca2dc-d7df-474a-8f8f-1858152c711e,e9f54bbc8f37bcc0fd0e5ccf1b682003531b72f5848cfecc1f4e46f5d358ae39
,9,ebiowie-the-planter,ebiowie the planter,Ebiowei has a reputation for nurturing plants.,Male,hair: bald; eyes: none; teeth: none; clothing: multicolored; accessories: none; expression: none; strength: powerful; weakness: none,f1df8270-4d60-4bd4-8959-ba7c384db5c4,d574878184732e7aafe455b5ffc7b3d7691765a78101892cff50a2f3eff0c103
,10,emeka-the-businessman,emeka the businessman,Emeka only cares about containers. No time to waste.,Male,hair: bald; eyes: white; teeth: none; clothing: orange; accessories: mask; expression: none; strength: hard worker; weakness: none,9b3d75da-4887-4089-aee4-50de3954fdc9,09ed9af87e3ee545bc959f51067cc1a46de21f5f454e37710f93273dbcb28a1e
,11,gbeminyi-the-monk,gbeminyi the monk,He lives in a monastery off the coast. No one has heard him speak in years.,Male,hair: bald; eyes: blue; teeth: none; clothing: yellow; accessories: mask; expression: none; strength: none; weakness: none,c8b1fd1d-8551-4bb4-8dc4-923a9aeb39fb,4932c9fffd83c0dff42ee12c00b0515a06553474e1af6d8c9d5c6929c58e8314
,12,henry-the-sportsman,henry the sportsman,He's played every sport known to man. Even cricket.,Male,hair: bald; eyes: yellow; teeth: none; clothing: multicolored; accessories: mask; expression: none; strength: agility; weakness: none,e1225451-bfdf-4a1f-8d37-9cce3a0bd67b,749d8349f24653de879cf16e37681eb42d70fe723cf5ed7b192eb1b7adfb23f3
,13,mayowa-the-smallie,mayowa the smallie,Mayowa is so small but everyone loves him still.,Male,hair: bald; eyes: blue; teeth: none; clothing: multicolored; accessories: mask; expression: none; strength: none; weakness: none,dfbb4163-df24-4d54-b74c-6218a68df8bd,f002ef965f0b410e64090ee14f7e85d2d0667743146531f7a2fbd47e896b7d24
,14,muyiwa-the-stylish,muyiwa the stylish,Muyiwa has a motto which is never to be caught unfresh.,Male,hair: bald; eyes: ash; teeth: none; clothing: multicolored; accessories: mask; expression: none; strength: creativity; weakness: none,dcf9d5a0-57b7-4126-a05e-6c8f1045d3f7,6295d9f4d28f0e758441c1965bb048ed42bed85240ef6fd32ea9f2caae71a0ab
,15,nina-paper-chaser,nina paper chaser,Nina loves money. It's all she dreams of. ,Female,hair: brown double bun; eyes: none; teeth: none; clothing: animal print; accessories: glasses; expression: none; strength: hustler; weakness: none,59524227-dc52-407c-8cca-e9e8c5fb3018,81fa6a5cd7d1b33bb637d0c318b9fba1ec4cd6287e029006c8684526d66cfc3e
,16,oluwaseun-spicy,oluwaseun spicy,He loves spicy foods. He cooks pepper and sprinkles rice on top.,Male,hair: bald; eyes: black; teeth: none; clothing: yellow and purple agbada; accessories: mask; expression: none strength: none; weakness: none,808f7007-6552-4efa-bd13-4b7c337b102b,07e29961bf306546fe513194fafc1759b8238ad16b0be2b3ce71e013210930d0
,17,sesan-the-smartie,sesan the smartie,Sesan always comes first in competitions.,Male,hair: bald; eyes: blue; teeth: none; clothing: orange; accessories: mask; expression: none; strength: intelligence; weakness: none,ba3edda7-8940-4ca4-97ba-826398d5909f,a379b8447c9e73c740c127f275cf5cd53389d98d429a82d9dfe9aa17882fea49
,18,tiwa-london,tiwa london,If she says she's in London and you see her; you're in London too.,Female,hair: braids; eyes: none; teeth: none; clothing: black top; accessories: glasses; expression: none; strength: none; weakness: untruthfulness;,78da7aeb-8352-4e25-89ac-dc48b5984089,de4ec7e58542c6beb3c62ca9604ca7bb791d003103d73fa9e40597b27f862e98
,19,tunde-yoruba-demon,tunde yoruba demon,Tunde derives joy in breaking hearts. It's a lifestyle.,Male,hair: bald; eyes: white; teeth: none; clothing: purple and yellow agbada; accessories: mask; expression: none; strength: none; weakness: promiscuity,53b46bd7-a537-402b-b249-0b4074a8faae,a31280650a779cbb2b56570046899a035c75d5115098fb1388b860832dcbb3e6
,20,yakubu-the-zombie,yakubu the zombie,Yakubu earned his zombie title because na only dust full him head.,Male,hair: bald; eyes: black; teeth: none; clothing: green and purple agbada; accessories: mask; expression: none; strength:none; weakness:slow to understand things,4adb6781-1614-424e-8f77-fe59ffca2209,e5503993dc3e100822cc421faabb938e5ec9585830a3bd2b822cf6c1a058d03f
TEAM CLUTCH,21,abdul-the-vibe,abdul the vibe,Abdul the life of the party and can never be caught un-fresh.,Male,hair: none; eyes: black; teeth: none; clothing: purple and yellow kaftan; accessories: cap; expression: happy; strength: strong; weakness: no limitation,770f817a-9d9a-4772-9a91-e66dd9d03470,876c2ae21584ea3427a1d09557ed0c44c50fe8b18dac5207550b4784812543ec
,22,emeka-the -clown,emeka the clown,Emeka the funny man; always making silly joke.,Male,hair: none; eyes: black; teeth: none; clothing: yellow and black ankara; accessories: cap; expression: straight face; strength: funny; weakness: little physique,78810fa6-a7ef-4d83-bf57-caf49db4ee69,ec7cb1837caad8438e06102ac0b77011eb3d21e093e87986886ec3fdaa23751c
,23,salam-the-odogwu,salam the odogwu,Salam is a big time textile marketer always sourcing for quality materials.,Male,hair: none; eyes: brown; teeth: none; clothing: wine and yellow; accessories: yayada cap; expression: happy; strength: influence; weakness: impatience,f2957ded-022c-4b07-92c6-b345d4816a67,9743279bfd9fb604b979b8efa8bb039ee10831a5a8a3b21f48d3c6b31c3de0f5
,24,charles-the-exporter,charles the exporter,Charles a business man an importer and exporter never to be caught idle.,Male,hair: none; eyes: grey; teeth: none; clothing: orange and blue; accessories: okpu ozo cap; expression: happy; strength: influential; weakness: incessant,09395e76-19ed-4852-8748-795ee7496a8e,03b9dc99e12aaef974e8e3b1aa8306c00b87f2a12c33f35bcd04ce7429e2dca3
,25,wole-the-pimp,wole the pimp,Wole knows people and his way around his city.,Male,hair: none; eyes: black; teeth: two white teeth with diastema; clothing :yellow dashiki; accessories: yori yori; expression: happy; strength: strong; weakness: promiscuous,4d94d4f7-9b69-4e43-9db1-1fe83df92857,af070dd3ef1e40d956b0a24ca7fcebf1ff5833e1a13cc8a414dbd284b4e3db13
,26,saro-the-baller,saro the baller,Saro is a baller and he is always ready to turn-up,Male,hair: orange afro; eyes: blue; teeth: two white teeth with diastema; clothing: black and yellow kente; accessories: none; expression: angry; strength: strong; weakness: insatiable,d35a7514-8996-42fb-a5f2-5a603ec679c5,a564b951d413daa1505d5c8354e6340139c8228e97a94aa8fd1a3c845bb4ead5
,27,ade-omo-yoruba,ade omo yoruba,Ade is an influential man and he is revered in his town.,Male,hair: none; eyes: blue; teeth: complete white teeth and a gold tooth; clothing: black and yellow kente; accessories: wine cap; expression:happy; strength: hardworking; weakness: procrastination,92984fa0-310b-4377-8a10-15965d044383,7a48f9b7308f099be6d5c4a60e38a6656086f21f676ee7e859adb4294de0fec5
,28,shola-cool-kid,shola cool kid,Shola prefers to be alone because he hates stress.,Male,hair: none; eyes: none; teeth: none; clothing: yellow t-shirt and blue dongaris; accessories: red facecap; expression: playful; strength: fun; weakness: playful,3ac5c186-bc14-4eb6-8567-cc818465a64f,69a3be9ef9b5677d78253e705da76d9a637f83d60f75e32fb2ce6064a2d58b13
,29,charlie-the-smoker,charlie the smoker,Charlie uses smoking as a coping mechanism.,Male,hair: none; eyes: black; teeth: none; clothing: black shirt with lion prints; accessories: blue cap; expression: happy; strength: nice; weakness: gullible,71a0aa22-d111-43b7-8484-43d87310bc42,0f63e155ffe3fc40e4107c2b3167af9965e83ccdbb60286c5ea73a1b3e0f3bc3
,30,femi-the-badguy,femi the badguy,Femi is one of the fliest guys in Lagos.,Male,hair: orange; eyes: black; teeth: none; clothing: white t-shirt and blue dongaris; accessories: smoking pipe; expression: unbothered; strength: fearless; weakness: intolerance,e493e3fb-a8a0-455a-854f-0f6474bbc69f,c88981e8fe36334518263c8f3977d17194a22172d72290497a723c9fd36c86c8
,31,sinzu-money,sinzu money,Sinzu loves spending money on flashy things.,Male,hair: none; eyes: blue; teeth: white complete teeth and a brown tooth; clothing: purple and yellow kaftan; accessories: green-stripped fila cap; expression: strength; strength: generous; weakness: aggressive ,942f8347-9932-4331-bd15-d0f3a048b54f,4e5a627ad141091ae63d7bf4c57ee664e504bee9988781af94f72c9eb25f130c
,32,obinna-the-palmwine tapper,obinna the palmwine tapper,Obinna taps palmwine for a living.,Male,hair: none; eyes: black; teeth: none; clothing: yellow black and a touch of pink ankara; accessories: cap; expression: happy; strength: contentment; weakness: naive,0f1af056-2548-4407-bed4-abc11deae05d,859a9a23a8e32c994d7ede48647da7eed89e547c1018a4d4fc951f5986ebe7fe
,33,aminu-maikudi,aminu maikudi,Aminu is a wealthy man from a family with generational wealth. ,Male,hair: none; eyes: black; teeth: none; clothing: maroon and yellow agbada; accessories: cap; expression: unbothered; strength: confidence; weakness: selfishness,0129e7a5-e3d0-4675-92d0-1a1e55d11612,c5b9d51896f0efbd7cf386f73b2cbf12e7759a4c5af53034a8c14415051a510e
,34,sabinus-the-town crier,sabinus the town crier,Sabinus delivers messages to his town people.,Male,hair: none; eyes: black; teeth: two white teeth with diastema; clothing: orange ankara with touches of blue; accessories: cap; expression: happy; strength: dexterity; weakness: impatience,01d4ce96-818e-44b1-8813-68a7d34b35ba,7bfcd72dc60c006a246fce9a1f5d1306fce9ac263e912428fce11b16d2163491
,35,adisa-ibadan,adisa ibadan,Adisa is an elegant man and he is adored by his people.,Male,hair: none; eyes: black; teeth: none; clothing: kente; accessories:abeti-aja cap; expression: mischievous; strength: independent; weakness: bossy,3a925f27-35f6-4dbf-9960-c6527fae5f3e,64030238facebbade83f4f4b175f72e7860da76e32eebf3619fd252988e5d16f
,36,linda-the-navigator,linda the navigator,Linda knows how to make a way for herself and the people around her.,Female,hair: blonde; eyes: none; teeth: none; clothing:multicolored; accessories: glasses; expression: confused; strength: creative; weakness: insecure,71f335a6-5a4f-4410-9cea-179336f0e498,32550d559252a11d0fd2cd2709b0d485be93b497fccff529e6d566b27e99f1a5
,37,kemi-the-iron lady,kemi the iron lady,Kemi the strongest woman known to the town of Igbede people.,Female,hair: ginger; eyes: none; teeth: none; clothing: ankara; accessories:glasses and a pipe; expression: cool; strength: disciplined; weakness: perfectionist,35b11a31-5b92-49f4-8fb1-30f255d22054,3ba4b162357eddba9a0633662df9d7849576530e5bf19680d3ce4fc38704dae5
,38,mercy-the-sassy lady,mercy the sassy lady,Mercy is a confident woman and never hesistate to show it.,Female,hair: brown; eyes: none; teeth:none; clothing: ankara; accessories: glasses; expression: sassy; strenght: creative; weakness: sensitive,7a3c70ac-927f-4a63-a3df-ab86dd27cd0f,b4464ec5a57b84c1c5cedc3751979ff475e6fe0556797997fb77560d2c92f6a0
,39,sandra-money,sandra money,Sandra likes getting and spending money.,Female,hair: brown; eyes: none; teeth:none; clothing:yellow and black; accessories: glasses; expression: confused; strength: brave; weakness: overthinker,1bd95fb0-7b2e-4354-bebd-22f9cf70a1ca,d331b26ff26df9f0895d43f76a907689ea1c28bfcfe4b5108b9d82b18402ee34
,40,bimpe-the-fashionista,bimpe the fashionista,Bimpe loves wearing trendy clothes and looking gorgeous.,Female,hair: blonde; eyes: none; teeth:gap teeth; clothing: black cold shoulder shirt; accessories: glasses; expression: shocked; strength: intelligent; weakness: procrastination,92b548b7-998b-46b6-8198-80d407209483,80d99b9de8db56338c3e65c48141972360601d74a3b17542372b7e1ff643e6ee
TEAM ENGINE,41,kim-rich-aunty,kim rich aunty,She loves spoiling her nieces and nephew.,Female,hair: pink; eyes: brown; teeth: none; clothing: ankara; accessories: none; expression: smiling; strength:brave; weakness:food,3344a73c-f15e-4afd-a1b2-3199e27eb08f,92eb51eec7e9c96fd5bf613f147e30a7ad4559897d6922bc92bfe19767626832
,42,barbra-stark,barbra stark,She loves fine dining and spends time with family.,Female,hair: blue; eyes: brown; teeth: none; clothing: ankara; accessories: none; expression: smiling; strength:brave; weakness:food,4f31fd99-4918-42a9-a112-fa60ef36d5c6,ad6b97936a7263e721e57ad39ccf83396f79a5c408dcbf128b6a0ca1522dce4b
,43,jean-art-dolger,jean art dolger,Loves collecting art for charity.,Female,hair: blue; eyes: brown; teeth: none; clothing: ankara; accessories: none; expression: smiling; strength: creative; weakness: food,5e1105d9-e485-462d-a5bf-1eb931976b13,b3a65b59e5d993dcfa8c30eb2f13586f75de5b1c9f7655253bd5926deceae4b6
,44,flora-burger- eater,flora burger eater,She loves eating burgers.,Female,hair: blue; eyes: brown; teeth: gap; clothing: stripes; accessories: none; expression: frowning; strength: prayerful; weakness: food,054dffd1-cdff-417b-b6c2-a679dabd087b,4b46985a9695d3b1a4d7a040987212027f10de6fad8f53ff4f9deb7d9188b16f
,45,jessie-lord-rings,jessie lord rings,She loves her  (precious) jewelry.,Female,hair: blue; eyes: brown; teeth: none; clothing: satin; accessories: none; expression: smiling; strength: kind; weakness: shy,caacabe1-0abc-43af-92e2-2231248bff93,a338f75f3b043b2416358063bfe21dbbd10a4b4365df2a3f30a337a2af586d63
,46,pinky-monky-ponk,pinky monky ponk,She love to dance the honky tonk.,Female,hair: maroon; eyes: blue; teeth: none; clothing: linen; accessories: none; expression: smiling; strength: brave; weakness: chips,bd6a4b38-543e-40fa-9153-f7e1a947ebb1,d957bd497b1e48fb29b64fac34ed97836011361d4c040f76be39b84c38c6f9c6
,47,wanjiru-hippie-glitter,wanjiru hippie glitter,A hippie that loves her glitters.,Female,hair: blue; eyes: brown; teeth: none; clothing: wool; accessories: none; expression: smiling; strength: none; weakness: babies,683f0d27-3cb4-4948-b1b5-09f10bee575a,9f9d4f8aeff904ba25ddc1e070c53291e2d90cb09155a647860724fb1575c075
,48,njoki-binary-coder,njoki binary coder,She codes with the best language and tops the set.,Female,hair: blue; eyes: brown; teeth: none; clothing: ankara; accessories: none; expression: smiling; strength: none; weakness: none,9b59bdb4-0c6c-4107-9d72-6d38d308edb4,836d7a580844c078bbb54da93ff937e39dd86a5f26e278b6d57d0c3389fdf1a4
,49,wangu-calaba-hustler,wangu calaba hustler,She is a passionate hustler you should be careful with her.,Female,hair: blue; eyes: brown; teeth: none; clothing: ankara; accessories: none; expression: smiling; strength: brave; weakness: flying,67f7da93-3925-4def-b660-58f558c14a19,39f0a125d2ed97a02d84d7310043d33625801c45fb1c039cc0d9b6e492b40292
,50,lulu-dey-kpako,lulu dey kpako,She's is as enthusiastic as she is beautiful.,Female,hair: blue; eyes: brown; teeth: none; clothing: ankara; accessories: none; expression: smiling; strength: loving; weakness: makeup,23b6c38f-ab84-4565-bfe9-d9eb019c9f29,4f3f2fe06e6197c79f992a6c30c8c1d913c917df0eb3f3b6774ebada5377c0be
,51,kiki-cala-flier,kiki cala flier,She flies first class and gets the best deals.,Female,hair: blue; eyes: brown; teeth: none; clothing: ankara; accessories: none; expression: smiling; strength: brave; weakness: kittens,d24aefff-c9fc-4ea9-a7cf-1b741076c822,6267a91c1d133e1a1a0f40dc96a741b7b8a51acf87a0a60f28bab3eadffce1f0
,52,purity-nft -investor,purity nft investor,She is an angel investor looking for the next big thing.,Female,hair: blue; eyes: brown; teeth: none; clothing: ankara; accessories: none; expression: smiling; strength: brave; weakness: clothes,ee86ef77-4793-411a-88d3-ea54d84f6b24,2925e8bca4775b0c2b18e689fc56cf113a751ab3de2a0ca70f69f47b441b5c7a
,53,june-binary-monk,june binary monk,She has a twin from Tibet and they always play together .,Female,hair: blue; eyes: brown; teeth: none; clothing: ankara; accessories: none; expression: smiling; strength: brave; weakness: money,102c4cdb-f812-44fd-bf47-5065284c6075,c12e569e2fb6d7429d56930f7cae14ced814fe25cb2ed33530cd6196bf5673eb
,54,aisha-flying-damsel,aisha flying damsel,She is always a damsel in distress and loves to fly.,Female,hair: blue; eyes: brown; teeth: none; clothing: ankara; accessories: none; expression: smiling; strength: brave; weakness: food,c4071af3-b49e-4ad6-898b-7828f90465fb,0feea6ca8151ae4520d2ba44695b0741fc3c53bb0c8cdfc83e180faaa0ae4a95
,55,bobo-crypto-lovely,bobo crypto lovely,She is a crypto guru you can trust all through.,Female,hair: blue; eyes: brown; teeth: none; clothing: ankara; accessories: none; expression: smiling; strength: brave; weakness: water,427ea0f5-30a3-4d70-a5bd-a6106409b83c,c9faf3e6e9c6a3aa42f52856998333858b30de7de6e152289d41dfeb93062383
,56,nell-light -embrace,nell light embrace,She is an empathy ready with a kind word or hug.,Female,hair: blue; eyes: brown; teeth: none; clothing: ankara; accessories: none; expression: smiling; strength: brave; weakness: love,9dfe30b4-c71a-471c-8091-f5c4a238eed8,5412e2eae8c1a8124ac64d0bf383eae73407f4afdfae6db0371703102dc56a9f
,57,rachel-mood-silent,rachel mood silent,Introvert  to the core a mysterious lady.,Female,hair: blue; eyes: brown; teeth: none; clothing: ankara; accessories: none; expression: smiling; strength: brave; weakness: walls,11450acd-f0d7-406f-bc18-bdb680404845,c9639f9392009d9d1be7318070f61c4db39413a3360cc056f8ac3724b537f206
,58,nana-reflector-agent,nana reflector agent,She loves her chrome fashion style.,Female,hair: pink; eyes: blue; teeth: none; clothing: ankara; accessories:none; expression: smiling; strength: brave; weakness: shy,63bda633-bfca-4b28-823f-7772936b4103,aa69fa41d960d335e2312c0a618490931e264c2b3ddde1a058c705c068206f50
,59,bree-busy-gossip,bree busy gossip,Never whisper your secrets to her except you want the world to know.,Female,hair: blue; eyes:white; teeth: none; clothing: glitter; accessories:none; expression: frowm; strength:goodlistener; weakness:height,4f5898d9-fc99-4053-a56c-b2ec1ef41347,a6de6ea7d65909db40be4c074133b7f2d86be4b17c7b3636ce86b128e9481b26
,60,jude-shadow-fighter,jude shadow fighter,A ninja warrior; the last samurai standing.,Female,hair: white; eyes:brown; teeth: none; clothing: ankara; accessories:chain; expression: smiling; strength:brave; weakness:water,a47b2ed7-d4aa-4404-ac40-0ecea464cf3f,d03f1c0d1996073348d65ddbeb9e00171a4a1df2f630cc9299221e755685ceb0
TEAM GRIT,61,toy-soldier,toy soldier,A man stronger than an army.,Male,hair: bald; eyes: closed; teeth: none; clothing: overall; accessories: nose mask; expression: happy; strength: powerful; weakness: sentimental,fc8ea3ac-59d1-11ed-9b6a-0242ac120002,66ae5a346f86d11c47aef0afdbada60c7b00208cefdcf8e59340143aed35e85a
,62,pipey-rivers,pipey rivers,A man who loves the water so much and fixes it's path.,Male,hair:bald; eyes: opened; teeth:none; clothing: overall; accessories: nose mask; strength: calculative; weakness: public speaking,58f69cae-59d1-11ed-9b6a-0242ac120002,d19e8e8eaccecac279d860a2a84a3a64d73ffa864e8483c81f0ce55f832deb72
,63,phiri-of-zambia,phiri of zambia,An african woman with strength and beauty.,Female,hair: purple buns; eyes:nose; teeth: none; clothing: adire; accessories: sunglasses; expression: jiggy; strength: free spirit; weakness: blind ,24b537fa-59d3-11ed-9b6a-0242ac120002,cb72ccdbd82152f2998b51c83ecb8e9027bd4a0a9f05d6ed5be9d2f41fc6ec1b
,64,patrick-of-bikinibottom,patrick of bikinibottom,A white man who loves the african culture and associates with their dressing.,Male,hair: bald; eyes: opened; teeth: none; clothing: kente; accessories: nose mask; expression: confused; strength: adaptation; weakness: fluency,064c7b84-59d3-11ed-9b6a-0242ac120002,eab39cd68ac9502d1f6b88724df5df9df6886d4e96a50722f4b6b81331d250e8
,65,nobuhle-of-zulu,nobuhle of zulu,A woman; well endowed with beauty.,Female,hair: brown bun; eyes: none; teeth: none; clothing: iqoyi; accessories: sunglasses; expression: astonished; strength: cool headed; weakness: pressure,1ee5b1ce-59d3-11ed-9b6a-0242ac120002,13425395c6603c5a23e634585eccb54b50f53172b6aae8f2d0e951d2a4118577
,66,nkosazana-of-xhosa,nkosazana of xhosa,An african princess; always proud of her culture.,Female,hair: ginger afro; eyes:none; teeth: gap teeth; clothing:umbaco; accessories: sunglasses; expression: fufilled; strength: confidence; weakness: endurance,2f1a1724-59d3-11ed-9b6a-0242ac120002,544c1eb057710aedbb74ad15fff570a1b1ae719bebe90fcce52cc7d00d73df98
,67,mandla-of-zulu,mandla of zulu,A simple and introverted guy who keeps to himself.,Male,hair: bald; eyes: opened; teeth: none; clothing: eshowe; accessories: nose mask; expression: irritated; strength: strong willed; weakness: relationship,d04553b2-59d7-11ed-9b6a-0242ac120002,f92f90314e2bde4a22c184f117b5d5ef634264d24dbc6e5025febaf38019a21a
,68,john-doe,john doe,A principled guy who is conscious of his health and ensures protection from infection.,Male,hair: bald; eyes: opened; teeth: none; clothing: ankara; accessories: nose mask; expression: cold; strength: cleaniness; weakness: perfectionist,5d19795e-59d2-11ed-9b6a-0242ac120002,1c53baed9bdc64377389380a52107f5e96863cb25c4b7491af9be5860da4e26c
,69,ghost-of-power,ghost of power,A woman; stronger than ten men combined.,Female,hair: black tied with scalf; eyes: none; teeth: none; clothing: iqoyi; accessories: sunglasses and pipe; espression: ruthless; strength: badass; weakness: cancer,29c764ca-59d3-11ed-9b6a-0242ac120002,2668c4a54fe4f28857c21faed9951c3b3bf556be9248c7dfc5ba7275bf19bbaf
,70,freida,freida,A man who is always peaceful.,Male,hair: bald; eyes: closed; teeth: none; clothing: overall; accessories: nose mask; expression: calm; strength: peaceful; weakness: anger,ee671c4a-59d2-11ed-9b6a-0242ac120002,2137ff12311ea05b9a6bdbc24b17f7b4befc0af61ee4c0c3fd0485a07ea8506d
,71,flamboyant-tree,flamboyant tree,A beautiful african woman; billionaire in the making.,Female,hair: one bun dark brown; eyes: none; teeth: none; clothing: kente; accessories: sunglasses; expression: happy; strength: beauty; weakness: lover girl,380e4990-59d3-11ed-9b6a-0242ac120002,79e91cd89996dc55bdb8af4e5b5200ee8a95f4610c618343b40c41d0a35f8d6a
,72,david-of-accra,david of accra,A combatant who fights and defends his people,Male,hair: bald; eyes: opened; teeth: none; clothing: kente; accessories: nose mask; expression: angry; strength: super powerful; weakness: sleeping,1c1ef1b4-59d1-11ed-9b6a-0242ac120002,ea5806faf7dc0a770c19ebbaa0fa5025e728c318c0d7316db83234e04fa5787e
,73,cally-lily,cally lily,A man who is a breathe of fresh air.,Male,hair: male; eyes: opened; teeth: none; clothing: overall; accessories: nose mask; expression: confused; strength: calm; weakness: sun,82bba87c-59d1-11ed-9b6a-0242ac120002,2c054aea1e414a5f0ece0cb5813aa41c4906c51639fbd3a0ecb949a60dc0443a
,74,bubune-of-accra,bubune of accra,A man with honor; always conscious of his health.,Male,hair: bald; eyes: closed; teeth: none; clothing: kente; accessories: nose mask; expression: happy;  strength: clean; weakness: foodie,faa4b530-59d2-11ed-9b6a-0242ac120002,51d50889fcb19ff160ab93836955a35ca22cf5fd1ed730c60b5dee6d937898b4
,75,bediako-of-accra,bediako of accra,A strong man; always ready to fight for what is right.,Male,hair: bald; eyes: opened; teeth: none; clothing: balck with kente; accessories: nose mask; expression: suspicious;  strength: activist; weakness: irrational,fb6e8222-59d0-11ed-9b6a-0242ac120002,f79882c57a933e5d9c45e983147e4d5878290ff531f774640cc2a172a5eeb455
,76,avatar-aang,avatar aang,A man who is ready to save the world.,Male,hair: bald; eyes: opened; teeth: none; clothing: kaftan; accessories: nose mask; expression: soothing; strength: mind games; weakness: insomia,169f93a0-59d2-11ed-9b6a-0242ac120002,c657aa3a058230163433b0e93623087f98656b89a6b6f47f0fa475bbcbaac735
