team names,series number,filename,name,description,gender,attributes,uuid,hash
,298,saro-the-clothemaker,saro the clothemaker,The yoruba man that stole the king's wife.,Male,hair: covered; eyes: grey; teeth: white; clothing: red and yellow agbada; accessories: cap; expression: straight face; strength: good-looking; weakness: womanizer,7e10af4e-1252-4f96-83a8-78411e152bae,cf6311490f0795b102c997ed8c39f78c657ba1ab72c53460a266d101e0abcdaa
,299,kalu-the-ichie,kalu the ichie,A man of wealth with afluence spreading all over the east,Male,hair: covered; eyes: sky-blue; teeth: white; clothing: orange plain and pattern shirt; accessories: cap; expression: happy; strength: wealth; weakness: pride,482ab247-73a4-4ff8-9172-732f3d0729b8,ca65d329374593bc0d8d96412e42a296e75bc99e1a333256a0dcd389a5cec549
,300,tamuno-the-prince,tamuno the prince,An Ijaw prince who is also the heir to the throne,Male,hair: covered; eyes: sky-blue; teeth: closed; clothing: akan;  accessories: cap; expression: straight-face; strength: caring; weakness: easily deceived,108447d1-f2d5-4816-8ebb-599286c3fabf,ffcb7ed4d1aa0a6b31aeef4df77059be12b4e9b07b21df74244fd152f6acd33f
TEAM SCALE,301,wendy-the -banker,wendy the  banker,"Wendy loves working in the bank, as she gets to meet different people.",Female,hair: dark red; eyes: blue; teeth:none; clothing: blue and yellow ankara; accessories: none; expression: shocked; strength: none; weakness: none ,1d51d23f-912a-4616-b265-2a4fd8f48260,6db16f71385dc07a7a97102e7859c621966461dc4581a4849ab5ede1df8cff2a
,302,uduak-the -dark horse,uduak the dark horse,Uduak looks innocent and has the whole apartment bugged,Female,hair: brown; eyes: blue; teeth:none; clothing: multi-colored ankara; accessories: none; expression: witty; strength: none; weakness: none ,4fc5ee8f-6b10-4a06-a799-317c9a8344e2,8af3513d391139a6016264846d63d26821290a48c203492600df4205281f8c77
,303,timeyin-the -eccentic,timeyin the eccentic,Timeyin is as eccentric as they come with no care for others opinions,Female,hair: brown; eyes: blue; teeth:none; clothing: multi-colored ankara; accessories: smoking pipe; expression: high; strength: none; weakness: none ,55aa2446-52d0-4b4e-af61-788784a29d8d,676f08db7f534bdd2f069cd078f18e711aed706b74246fe20468aa4c3ba9908b
,304,omawunmi-the -businesswoman,omawunmi the businesswoman,Omawunmi is a no-nonsense woman with a shop in idumota,Female,hair: pink; eyes: blue; teeth: white teeth; clothing: yellow ankara; accessories: none; expression: angry; strength: none; weakness: none ,678c63f7-69a5-4082-9dd2-cabf9234dbc4,1f4b374a823da99c3f026b9f92180f58aab3c702156bb561514895e77e95bd03
,305,halima-the-housewife,halima the housewife,Halima loves to bake and cook for her children,Female,hair: brown; eyes: blue; teeth: none; clothing: ankara designed with yellow red and green; accessories: none; expression: tired; strength: none; weakness: none ,2275b7d4-fee8-483f-adfb-517ec3f25f3d,a211d60d4299426496cf66f92d3bdcf65c147bef2b3af519d6cd82b375e52dce
,306,muna-the -block sister,muna the block sister,Muna loves to tell everyone in the block about her younger escapades,Female,hair: black; eyes: blue; teeth: none; clothing: wolf skin ankara; accessories: headgear; expression: shocked; strength: none; weakness: none ,86decb02-71e9-4826-bfdd-611db2f9d95e,a6f04e76658ee41928fce9a8b2c7bb19310f6ef2807b462279fe36773bed4783
,307,stella-the -gossip,stella the gossip,Nobody gossips on the block like stella when smoking.,Female,hair: red; eyes: covered eyes; teeth: none; clothing: black ankara with bright design; accessories: none; expression: calm; strength: none; weakness: none ,9d6d17db-eca7-462c-b975-214a93198914,7a4137388e9d6f37818eb52c695eb3c7a8d77be7feb36c858ef248b3461a48ac
,308,agbani-the-wannabe,agbani the wannabe,Agbani loves to shop antique decorations for her mansion in Idi-Iroko.,Female,hair: purple hair; eyes: covered eyes; teeth: none; clothing: blue one-armed dress; accessories: none; expression: happy; strength: none; weakness: none ,baab2dff-73fc-44f8-9c1b-3473018a1e32,6faf874f93a67684f56e19cf1cf0c954dcc58c644e635e863207b44696456c13
,309,asante-the -warrior,asante the warrior,Asante came from a long line of warriors in Ghana.,Female,hair: pink braids; eyes: covered eyes; teeth: none; clothing: one-armed brightly colored dress; accessories: none; expression: calm; strength: none; weakness: none ,c7a25f63-441e-49db-9718-6f48dfcb6b7d,1bb06ed1f44f4450a10ce940631a83b3f82cf2fea45d53e6dc1f8fd16da6b59e
,310,hilda-the -insomaniac,hilda the insomaniac,Hilda prefers to sleep during the day.,Female,hair: pink; eyes: covered eyes; teeth: none; clothing: multi colored ankara; accessories: none; expression:calm; strength: none; weakness: none,10d02fba-84c8-40bd-b7d6-f27d9431be7f,3ffa643fd8f2d98fb85ce50727df977824ec8d2188bc4cd7d0cda2d69137ddfc
,311,sisi yemi-the -street aunty,sisi yemi the street aunty,Sisi Yemi is everyone's favourite street aunty.,Female,hair: dark brown; eyes: brown eyes; teeth: none; clothing: blue and yellow ankara; accessories: none; expression: shocked; strength: none; weakness: none ,196bd3ac-165d-4c28-bb43-fdc4e95d3e7b,b5e5dab78b5330741ba4b657cd8bd219ff3f8d73658eab70ff1ef82aea48eff9
,312,chiamaka-the -bully,chiamaka the bully,Chiamaka hates people in her business and likes to scare the kids on the block.,Female,hair: pink; eyes: brown; teeth: none; clothing: multi-colored ankara; accessories: smoking pipe; expression: strong; strength: none; weakness: none ,10f44a39-9d46-43e1-a650-b288fcef2564,22c924c37ca532bd3bd2fc76cce0577c07910916b5e60b08ad3cf4758c3a1f9a
,313,gift-the-fashionista,gift the fashionista,Gift has always been bold and that spreads to her fashion sense too.,Female,hair: brown; eyes: brown; teeth :none; clothing: multi-colored ankara; accessories: none; expression: witty; strength: none; weakness: none ,0775764b-bd66-45eb-95db-ed0bc3b4ce96,d871c10f3ef3c54ddb43200a1a1e89f310f8592219cc84d08e3013f5091b5379
,314,omoyene-the-weirdo,omoyene the weirdo,Omoyene likes to murmur to herself and talks about seeing ghosts.,Female,hair: brown; eyes: brown; teeth: none; clothing: yellow ankara; accessories: none; expression: calm; strength: none; weakness: none ,f937a43e-4068-4239-81fc-2d38b805bb24,6d2d131638d71a7660a0d758495e574d655b0f7e76a73763b2787eb17a1904a9
,315,maria-the -freshface,maria the freshface,Maria likes to believe the world is sunshine and rainbows while blowing gum.,Female,hair: pink; eyes: brown eyes; teeth: white teeth; clothing: yellow green and red ankara; accessories: none; expression: furious; strength: none; weakness: none ,ad9e356a-eac3-4b88-ab26-d5b160480f79,61b4c3c912c35c7ad890401d3aa7bfd2337832a1d955cc7d17efaf0cbe434bb9
,316,monica-the -smoker,monica the smoker,Monica is never found without a pipe and loves to interject in every conversation.,Female,hair: grey; eyes: covered eyes; teeth: none; clothing: black ankara with bright designs; accessories: yellow glasses; expression: hip; strength: none; weakness: none ,328fcef2-81c3-4620-9446-c472ba7495ea,1298b77e79e3fd50d4f5ca9f73294e9eab91499bd0294052dbd7c40c72a37f38
,317,janet -is always -found singing ,janet the singer,Janet is always found singing in whatever activity shes doing.,Female,hair: purple; eyes: covered eyes; teeth: none; clothing: yellow and blue ankara; accessories: yellow glasses; expression: cool; strength: none; weakness: none ,50393214-af0c-4e21-88f7-5c031c46a8b4,bffd43f2b9418f4d7980044cf127a1b4672155637c4bd42a371b1e081e7e9d47
,318,emi-the-reggae-girl,emi the reggae girl,EMi is a beautiful dancer; she rules the reggae world.,Female,hair:pink braids; eyes: covered eyes; teeth: none; clothing: multicolored ankara; accessories: yellow glasses; expression: happy; strength: none; weakness: none ,a5435181-91be-47eb-9df1-002115e1fbdd,dd42599b57f46e6b51b6ae10a1c35ce596e7a580fa58d54aaf5122ef1c700642
,319,aisha-love-the-life-of-the-party,aisha love the life of the party,Aisha always party during the weekend.,Female,hair: red; eyes: covered eyes; teeth: none; clothing: wolf skin ankara; accessories: yellow glasses; expression: hip; strength: none; weakness: none ,04eb2777-ccee-411d-be96-dfd02605b329,fef9e6aebb6617215fc830c579a11a5a8719c2a9196bd30708eedba9f6f19523
,320,amaka-the-tailor,amaka the tailor,She sews the most beautiful dress in the hood.,Female,hair: grey; eyes: covered eyes; teeth: none; clothing: black dress; accessories: yellow glasses; expression: happy; strength: none; weakness: none ,df0f57cd-1b63-4345-a5e3-1ee60d81d98c,5156663a076c1d698859ccedabf5e955985ea7ad928f5a2729458ad079cefc1c
TEAM SANDPAPER,321,omunyinyi-the-stoic,omunyinyi the stoic,Omunyinyi wears a Kitenge coat.,Male,hair: bald; eyes: teary; teeth: none; clothing: checked ankara; accessories: none; expression: teary; strength: powerful; weakness: self-loathing,c2d6a3ac-1d4d-4268-ba7f-4f0f8f50c1ab,2ee870e28fbf3100bc4522ca8c58ecd751e4b405760e76fddd60a4ab64067a14
,322,kamau-the-sleeper,kamau the sleeper,Kamau has his eyes closed as he meditates.,Male,hair: bald; eyes: closed; teeth:  none;  clothing: black ankara; accessories: none; expression: flat; strength: open to suggestion; weakness: always sleepy,20330f5c-40c2-4f6a-b9d8-d1d04fb97daf,b0d364db30e2c101dbaa2bd6a4331ba46112b0bb8ccce0aa38e50bffce8fc012
,323,mutiso-the-lastborn,mutiso the lastborn,Mutiso is masked up but dozes off while waiting for food. ,Male,hair: bald; eyes: closed; teeth: none;  clothing: yellow ankara; accessories: none;  expression: tired; strength: consistency; weakness: pessismist,0706c338-42eb-4d26-84ea-c24b39628200,4eeeff7dd3e1c7c9e1ef05bddff3864e53be620742131c5e259f0b60c6d0548e
,324,omondi-the-vegeterian,omondi the vegeterian,Omondi wears a green coat with lots of patterns. ,Male,hair: bald; eyes: sharp eyed; teeth: none;  clothing: green ankara; accessories: none; expression: alert; strength: leader; weakness: anxious,bfb5e8d5-d7a7-4aa8-85e8-d7d9afd4adb3,106e3a9f5e50c00d235666f8514fb9f056473c211c76713c019272fd005cea9e
,325,barasa-the-optimist,barasa the optimist,Barasa looks up to the sky and makes a wish.,Male,hair: bald; eyes: blue; teeth: none; clothing: brown ankara; accessories:none; expression: awake; strength: strong willed; weakness: immoral,2da4bef4-38cc-4414-99ad-7361fac04b2b,55dca0c2704cf851e0ce247aa59bc647033fdfe9622bed0f34bc17b38e406b85
,326,mwembu-the-elder,mwembu the elder,Mwembu is old but not so old and yellow is his favorite color.,Male,hair: bald; eyes: black; teeth: none; clothing: dark ankara; accessories: none; expression: plain; strength: fulfilled; weakness: angry,36181230-6ac9-417f-af5c-23bdd2c25ecb,d51a4b6b1d6f7aff123a4241502abd2a434a864c2c9cf90343e5ee313156bebb
,327,mbogi-the-fighter,mbogi the fighter,Mbogi is captured and forced to wear a mask. ,Male,hair: bald; eyes:  black; teeth: none; clothing: one side ankara; accessories: none; expression: willfull; strength: fighter; weakness: rebellious,3a7bc3c4-1463-42ce-84c9-07337da64435,d852555ff62cfd45d59700d46445f5556866c32da2607858840baac5d465fe9c
,328,mrosho-the-runner,mrosho the runner,Mrosho has his mask on and yet still runs his race. ,Male,hair: bald; eyes: sea blue; teeth: none; clothing: purple ankara; accessories: none; expression: alert; strength: visionary; weakness: destructive,b2ca2c76-3b6d-43f1-8cc9-089b6ab83876,95a31fc3231e33f5366726a066ceb281c8c09138e1577bf473978a33c2076dab
,329,milele-the-african,milele the african,Milele wears a dress with a nice african print in orange.,Male,hair: bald; eyes: blue; teeth: none; clothing: orange ankara; accessories: none; expression: timid; strength: leader; weakness: failure,644b0259-d75c-456d-934c-ce7c052bad3a,2a8101348937e9980b1b56660a4ed8eb6903211822be1d42bbae30817e751ed3
,330,olebon-the-oloibon,olebon the oloibon,Olebon is in a customized buba sokoto.,Male,hair: bald; eyes: closed; teeth: none; clothing: animal print; accessories: none; expression: surprised; strength: empathy; weakness: easily bored,de261efe-731d-461e-b2e4-42edd2f48f72,de02856f4bd1b91c3cd4d8274bc3a9658ea1388326f8b8a57149fe437d321001
,331,chifu-the-maasai,chifu the maasai,Maasai shuka keeps bringing inspiration for new clothings. ,Male,hair: bald; eyes: closed; teeth: none; clothing: ankara shirt; accessories: none; expression: visionary; strength:  authentic; weakness: selfish,239933c4-7177-4b5b-86e8-e6f952301344,f4fc502b99edd683e574aa47c0632b4338b2de8efd486857d4af9f288ce2c200
,332,mwangaa-the-voice,mwangaa the voice,Mwangaa the chief is controlling but still loved as he has a calming voice.,Male,hair: bald; eyes: blue; teeth: none; clothing: white lined ankara; accessories: none; expression: kindness; strength: brave; weakness: impatient,49179b62-812d-4d0f-b518-4af7fa79f8bc,0687992c1bc6c2a8e1d35a2e97ed8a70c6c7d753cb5f48de909f0617943814e0
,333,waforte-the-first,waforte the first,Waforte loves to sleep and does nothing else.,Male,hair: bald; eyes: closed; teeth:none; clothing: jean ankara; accessories: none; expression: shy; strength: none;  weakness: selfish,871912a8-d96e-4594-b7b3-450d94ee6924,ec9d5739e011d25532d6c89675b8b1470046ddee8f3d3893d87707f2c6643f83
,334,kariuki-the-prayerful-one,kariuki the prayerful one,Kariuki closes his eyes as he watches the sunset.,Male,hair: bald; eyes: closed eyes; teeth:none; clothing: none; accessories: none; expression: bored; strength: intelligent; weakness: passive,6a5b6fa6-0f91-4b01-957f-c766945eb704,421317797f5d18b3b5c90312622ec97254ebc28f285c9d655fd00a707f7d9d7f
,335,kenyanese-the-priest,kenyanese the priest,Kenyaanese is a masked up man with a white cloth as his signature attire. ,Male,hair: bald; eyes: white; teeth: none; clothing: white jean shirt; accessories: none; expression: calculative; strength: kind; weakness: takes things personally,0706c338-42eb-4d26-84ea-c24b39628200,b5237f4e7185aca46b5eb332160dbb782faa4b8f9f486fa9950882b3acf5fed9
,336,nyimbo-the-singer,nyimbo the singer,Nimbo has his glasses on and a pot with hot porridge for the night,Female,hair: dreadlocks; eyes: glassed up; teeth:none; clothing: off shoulder ankara; accessories: a pot; expression: free spirited; strength: fair; weakness: impatient,d05af807-b3e9-4ad3-8df1-b7864d2daa33,87b9505096000cfef4cc2143237696ff0fcf8dd6fbfd1ff51fbf3bab8532f5d8
,337,maathai-the-nobel-winner,maathai the nobel winner,Mathaai the warrior is revered all over the land. ,Female,hair: pink afro; eyes: glassed up; teeth: none; clothing: colored ankara; accessories: none; expression: strict; strength: leadership;  weakness: short sighted,0871cb8c-8d56-445d-92c7-01793f327707,9fefa7203e8f8a098f58fa69a1bd348d6ed0dcea2036b69f8b3a6469eb16e587
,338,tish-the-angry-one,tish the angry one,Tish is always angry and with specs on he looks really mean. ,Female,hair: black huge afro; eyes: none; teeth: broken teeth; clothing: off shoulder ankara; accessories: none; expression: disgusted; strength: blunt; weakness: greedy,750a89dc-44ff-43bf-8211-b7776f1b5e52,7dc62917386e080f7a9a603a1c81538c807b8e809ba4e937b999b85c3de825e6
,339,wamenza-the-winner,wamenza the winner,Wamenza the leader has led his team to yet another thrillig victory. ,Female,hair: laid back; eyes: none; teeth: none; clothing: off shoulder ankara; accessories: none; expression: meditative; strength: strict; weakness: impulsive,7348c9ed-4ac9-4785-9434-0a1f0dcaf8d8,8449fcd697823f97f72cdf73aa7e1bae2ed904cee64d2bf6fee07e9e7e775b8b
,340,isaya-the-track-king,isaya the track king,Isaya the traveller has done a lot of travelling round Africa. ,Male,hair: none; eyes: glassed up; teeth: none; clothing: bright ankara; accessories: none; expression: taken aback; strength: straight forward; weakness: selfish,41781a16-d2b8-4fc6-a1f4-b9fffc5c95ba,78c095934fa25840d621f9ee4c9f6bfb05c25044d5ccb5b5965eafd645fb2d1c
TEAM RULER,341,mansur-the-partyrider,mansur the partyrider,Mansur is the life of a party and never caught dulling.,Male,hair: none; eyes: ash grey; teeth: none;  clothing: agbda; accessories: studs; expression:happy; strength: intelligent; weakness: red whine,78db0f29-3936-4d9c-bb90-3dbf20dba2dd,689bb451969271433738980b225413912e5f806e9b04bafd7d3450dc659dc7d3
,342,tola-the-businessman,tola the businessman,Tola loves business and owns several shops in Idumota.,Female,hair: none; eyes: midnightblack; teeth: none;  clothing: purple blowse; accessories: mask; expression:furious; strength: powerful; weakness: love,1c5d5a6b-cf04-4bf9-978e-22a7e9bc5819,36582c0fc30b748b2e4324f3f77d6019ba6364de1079edd3480855d97bb169f3
,343,abdullahi-the-honorable,abdullahi the honorable,"Popularly called ""buje budanu"" a godfather who lavishes money on young gees.",Male,hair: none; eyes: blue-blackish; teeth: none;  clothing: yoruba attire; accessories: none; expression:anxious; strength: foreseer; weakness:indecision,dd708276-445f-4483-8357-fc08e999328f,c64f8daec10f1a7207554f8c00e4ae781be4ce80dae3cc8f003ad7fead325a1b
,344,ojukwu-the-badguy,ojukwu the badguy,Ojukwu is a business minded guy but fun to be with.,Male,hair: bald; eyes: eagle eyeball; teeth: none;  clothing: yellow lining blowse; accessories: none; expression: none; strength: good eyes for fashion; weakness: lack will power,76c1eabf-15ea-446a-8426-472982c4d800,1d6627a5a8880e531201d019ba8d558d580732735f58548774c05f97768dbf32
,345,odunsi-the-egbonadugbo,odunsi the egbonadugbo,Odunsi loves to advise and people in the community rely on him.,Male,hair: none; eyes: dark brown; teeth: none; clothing: one shoulder gown; accessories: none; expression: none; strength: elegant; weakness: easily depressed,2912ab8b-5875-4277-a5c2-a0209aee90ae,f510198e2f3c3256d96213bf66d7a11a0c85f112f310dc983e6f495711b9352d
,346,ogogo-the-sugardaddy,ogogo the sugardaddy,A rich oil magnate who loves to solve young women's problems with his millions.,Male,hair: none; eyes: cat eyes; teeth: none; clothing: purple danshiki; accessories:nose mask; expression: straight face; strength: brave ; weakness: too selfless,aa575f30-04ad-45f9-a798-199465117793,bcfde2ac52bd72a564f79ee40eb4447a6274ea6ada5abbff14864caa5b208048
,347,suli-the-amalaseller,suli the amalaseller,Suli sells amala with respect and people say that's the secret to her sweet food.,Female,hair: low punk; eyes: cat eyes; teeth: none; clothing:brown babarigai; accessories:none; expression: furious; strength: wealthy; weakness: too emotional,46fd4821-04dd-4f65-9290-c130a00c4c93,125886e5cd1aefea4905d844ba8a1c8098fe44733dfdb2855d04c99abd47aff1
,348,dolapo-the-afrocentric,dolapo the afrocentric,Dolapo loves African prints and loves to showcase culture.,Female,hair:bald; eyes: brown; teeth: none; clothing: one sided blowse; accessories: nose mask; expression: none; strength: beautiful; weakness: forgetful,cbab232b-5c62-4df8-867b-018a2e496cd4,b18501d33319833a61eb6d0bcb36418361df465a3a5a5ad5fa0dec3170cc6d42
,349,danjuma-the-saddist,danjuma-the-saddist,Danjuma is a grumpy man no one likes to associate with him.,Male,hair: none; eyes: sky blue; teeth: none; clothing:purple agbada; accessories: neck beads; expression: excited; strength: outspoken; weakness: boring,5a42af57-186e-425b-b6b1-f72bda4911ef,76b762f023599fa9c6141f996101c40861c1e147a7a3d9e428a27f6d92f55263
,350,chinedu-the-farmer,chinedu the farmer,A hardworking farmer who has 6 boys who help out on the farm.,Male,hair: none; eyes: black; teeth: brown; clothing: one sided gown; accessories: none; expression: blushy; strength: easily loved; weakness: get angry easily,9e8a55d7-0d8d-465d-a628-08ddd387a2c6,d60b15852f3a657b0e2aa7349793718f473b234d4aec0281c812939d477b3073
,351,kola-the-baldguy,kola the baldguy,Kola is every girls dream man because of his hair style.,Male,hair: low cut; eyes: mouse eyes; teeth: none; clothing: gbariye style; accessories: nose mask; expression: unhappy; strength: good eyes for details; weakness: sluggish,c32f1757-da9c-49e8-bd79-510a42b6971a,97d2a6bddfbdd2d93b277c541c984f8df92331ab18a3c57fab4f4221fcf3ccab
,352,bola-the-bosslady,bola the bosslady,A lady who supports the boy child by providing scholarship to young talented males.,Female,hair: low cut; eyes: brown; teeth: none; clothing: short orange gown; accessories: nose mask; expression: none; strength: industrious; weaknes:spend lavishly,09ff910d-a2be-49d5-8b27-b9378458701c,05576b65ece11cf332b54acf21faf531c884beb8de0f67dc473225e292de349f
,353,kunle-the-alienguy,kunle the alienguy,Kunle is special and easily get noticed even in the midst of crowd.,Male,hair: green punk; eyes: green; teeth: none; clothing: purple agbada; accessories: purple beads; expression: unbothered; strength: very energetic; weaknes:eaaily give in,dea2f5d8-e3ba-4d3f-9a17-0a7edfd0c100,fb725a0a302e050ff5cd8b09d3ed5236339d8231f62276fbf755d37fd9b07e1e
,354,segun-the-sharp,segun the sharp,Segun drives with caution and people love him for that.,Male,hair: green punk; eyes: black ; teeth: none; clothing: orange buba; accessories: nose mask; expression: bitchy; strength: team player; weaknes: none,f9159a9c-f48d-4aee-bcc1-63c86209f806,a4af3ce410e383b563a7531d3d90523fc244bcfbaa63d990fe011a9ca0d7a88f
,355,ola-the-hardguy,ola the hardguy,Ola may be feared but he is such a coolheaded champ.,Male,hair: none; eyes: closed eyes; teeth: none; clothing: purple buba; accessories: none; expression: sick; strength: quick recovery power; weaknes: get ill frequently,a814fc77-bdfa-4e50-8ba8-3e4e4bcfb3c0,bce36885dd1b216bf87790e5a8f3cc61ff91994cfe506e1ea5e6af8b478e33d4
,356,emeka-the-chief,emeka the chief,Crowd are always at Emeka's house because of his selflessness.,Male,hair: none; eyes: closed eyes; teeth: none; clothing: pakaja attire; accessories: none; expression: bossing; strength: easily comman respect; weaknes: not a ladies man,195e89c8-0b6f-43ad-9a2c-d20f03439e96,e9cdab7b8888e0ce95b5f3f84f7ad252b8e740ca560f1e57beb44a450b7225db
,357,ugochukwu-the-celeb,ugochukwu the celeb,Ugochukwu is an online celebrity with many followers on social media.,Male,hair: white blode; eyes: closed eyes; teeth: closed teeth; clothing: black gown; accessories: gold shades; expression: bitchy; strength: enterprising; weaknes: too emotional,74775cda-cff4-4d21-8819-693127598eca,718e41d95f06fca5c36e55c31043e7dca38215a249fc3cf3ce0d2dba9edf879c
,358,adekunle-the-yorubademon,adekunle the yoruba demon,He might be every woman's man but faithful and loyal to one.,Male,hair: gobi cap; eyes: closed eyes; teeth: closed teeth; clothing: ghana dansiki; accessories: gold shades; expression: owanbe mood; strength: from a walthy home; weaknes: disrespectful,5c98c2d8-3144-4e08-8a0f-9b8d7e4f5aa7,9c2447e6d31230351b36345cb102ba6d55141d68b9a8d0608271bf682d86e9c9
,359,favour-the-fashionista,favour the fashionista,Combining dresses is not a problem for Favour.,Female,hair: black ghana weaving; eyes: cat eyes; teeth: none; clothing: senegalese blowse; accessories: gold shades; expression: party rider; strength: smart; weaknes: lazy,19fc15c3-80fe-4d45-a2fe-be8f087d57c4,522e4c70dead52333694e91575db475730819ff440f3ef9c6f5fae1b1a2041ba
,360,jane-the-slayqueen,jane the slayqueen,Jane is always found in the midst of men and loves partying.,Female,hair: long grey braids; eyes: closed; teeth: black lips; clothing: black short gown; accessories: gold shades; expression: happy; strength:very intelligent; weaknes: have mood swings easily,74775cda-cff4-4d21-8819-693127598eca,6878f613c11adce90135aa5ea4fbb017ca9ed77ff8c87a98b5fd59d13d041622
TEAM VBELT,361,osas-the-ceo,osas the ceo,Meet Osas; a Gen-Z CEO with the British accent.,Female,hair: purple dreadlocks;  eyes: none; teeth: none; clothing: danshiki;  accessories: gold glasses; expression: none; strength: none; weakness: none,b10f7e42-4778-49db-820b-dabbad75504a,a5d5a8ac4dc6eede8767e81999b9f6c569409f65b5c6011f191b87e5046b21c0
,362,nneka-the-rainbow babe,nneka the rainbow babe,Nneka; the happy rainbow babe with the vibes.,Female,hair: pink;  eyes: none; teeth: none; clothing: blue and black bichrome; accessories: gold glasses; expression: none; strength: none; weakness: none,e7e20ab8-03e0-4e0a-80aa-6e193f84426e,b7950bd7da663a34d7d9d61af7277dddf6dfa9abef60010e25c4dedf6df0bd16
,363,temitope-the-spoilt girl,temitope the spoilt girl,Temitope; our favourite daddy's girl.,Female,hair: none; eyes: none; teeth: vampire teeth; clothing: right one-shoulder wax print; accessories: gold glasses; expression: none; strength: none; weakness: none,10cbcbcb-754e-4175-b85d-d0c7eafa16a2,aec232900f90cbd8eef88dc126d93e81235d91f55ea7663a98012227f8fe4364
,364,bekeh-the-party animal,bekeh the party animal,Baby Bekeh is life of the party that goes home with your charger.,Female,hair: dark brown;  eyes: none; teeth: none; clothing: left one-shoulder wax print; accessories: gold glasses; expression: none; strength: none; weakness: none,f0558235-3043-46e5-b26c-5bde83cc67fb,60c4077805077a76669a03c989d7b6575c3912189d225fdde92d1fb39249baa8
,365,nana-the-tech lady,nana the tech lady,Nana; the tech madam that doubles as Kumasi Adele in her bathroom every morning.,Female,hair: black; eyes: none; teeth: none; clothing: print kente;  accessories: gold glasses; expression: none; strength: none; weakness: none,e0858913-7050-4c4a-a2a0-442a88463334,7b0b7c61f3f3753382bb4392aff09437ca2fa6e09495a588d3615bc9b41eb818
,366,rofiat-the-marketer,rofiat the marketer,Rofiat; the distressed marketing intern.,Female,hair: purple dreadlocks; eyes: brown; teeth: none; clothing: danshiki; accessories: none; expression: none; strength: none; weakness: none,1e4d9bda-f6f9-4e7a-9381-bee4b074b56d,dd978cbb0695aa084e698a1f7e14d8df821f8e76ea4ecb18beddde363cf1b231
,367,zarifa-the-righteous,zarifa the righteous,Meet Zarifa; a proper baddie for Christ.,Female,hair: pink; eyes: blue; teeth: none; clothing: v-neck original kente; accessories: none;  expression: none; strength: none; weakness: none,c6955d16-c343-46bc-9bed-c069ea8cc65a,4c8b4c1884754eead0498e2292e0cc7655f2ec0904612beacf9fa887855b303f
