team names,series number,filename,name,description,gender,attributes,uuid,hash
,77,argus-greek,argus greek,A man who you will always find on the look out.,Male,hair: bald; eyes: opened; teeth: none; clothing: overall; accessories: nose mask; expression: suspicious; strength: strong;  weakness: lateness,e7f26b26-59d2-11ed-9b6a-0242ac120002,a64cf5a556afb9bc867d25e7682e705341511691a923557df7ffb8871d158938
,78,amahle-of-zulu,amahle of zulu,A traditional man; feeling fulfilled.,Male,hair: bald; eyes: closed; teeth: none; clothing: ankara print; accessories: nose mask; expression: excited; strength: conversationist; weakness: traditionalist,169f93a0-59d2-11ed-9b6a-0242ac120002,06a16f91df89ec429224ad99768d6cee0ce27284cb2ebfd93c9ed78e00021641
,79,agnar-ole,agnar ole,A man who feels like an outcast and always has a battle with his mind.,Male,hair: bald; eyes: opened; teeth: none; clothing: overall; accessories: nose mask; expression: furious; strength: strong willed; weakness: crying,f3f11fd0-59d2-11ed-9b6a-0242ac120002,04f60c79269a8cc241d05fb8a99337f7571892f708ca190021b1dc23db857602
,80,adom-kulu,adom kulu,A ghanaian model; proud of his culture.,Male,hair: bald; eyes: opened; teeth: none; clothing: kente; accessories: nose mask; expression: irritated;  strength: height;  weakness: pride,00f6589e-59d3-11ed-9b6a-0242ac120002,ad13a475d9d6232627e040d30468c07c50ebe92a5d6b4ca91b5db6f8cb4bc4b5
TEAM PRYBAR,81,segun-baller,segun baller,A man who loves to have fun.,Male,hair: black; eyes: black; teeth: none; clothing: kente; accessories: glasses; expression: cool; strength: jovial; weakness: nonchalant,58ac5cf6-b644-41c6-af79-ec9aa5f6bdd1,81e8355ccc82f23961ad98e5fb2182ec269fe10d1e65417ec286a930f7ec52d9
,82,bolanle-pepper-dem,bolanle pepper dem,A lady that loves to show off.,Male,hair: bald; eyes: back; teeth: none; clothing: kente; accessories: glasses; expression: proud; strength: strong; weakness: big spender,46966104-775b-4443-90bb-b35afd121653,6945e2ae13fae1963e78485df71aede853077b4d836be4ca9f2883b8e9ec2d75
,83,tayo-tailor,tayo tailor,A professional fashion designer.,Male,hair: black; eyes: black; teeth: none; clothing: orange shirt; accessories: glasses; expression: inquisitive; strength: creativity; weakness: opinionated,70828783-ac38-48cf-b966-cfebc92ebd86,5294bf7ba3dfc93e713a3337ddec1b9cef2beddd39e1fba619bd1c77ff3e3d96
,84,ajasco-comedian,ajasco comedian,A newbie comedian.,Male,hair: black; eyes: black; teeth: none; clothing: green shirt; accessories: glasses; expression: bold; strength: optimistic; weakness: unobservant,8bebdb3a-f0a8-47ba-892f-39aa275fbd0d,e4df588233127cc35bfb4570fafb2f4aca8b2f3fd43ab635da761269473a610b
,85,tobi-babyboy,tobi babyboy,A guy who does not like stress.,Male,hair: black; eyes: black; teeth: none; clothing: white shirt; accessories: glasses; expression: friendly; strength: outgoing; weakness: lacks boundaries,3da592d4-5dec-4bc5-8412-f1b2a0269f95,5dd667c2c8c9047d43e14644ad56e21f9f4698afb89002d4b8c5449844d72052
,86,esther-sassy,esther sassy,A rude lady.,Female,hair: brown; eyes: grey; teeth: none; clothing: animal print; accessories: necklace and earrings; expression: bold; strength: confident; weakness: judgemental,0642a25a-966d-446f-b021-a6d18e7fa0c5,5fb17c8c69633c305b945eaa5f7f8bf1457636ecf5d41a54f040a52921a14de4
,87,ozo-fineboi,ozo fineboi,A charming person.,Female,hair: brown; eyes: blue; teeth: none; clothing: aztec print blouse;  accessories: choker and hookah; expression: blank; strength: charismatic; weakness: proud,f2286b4d-fae6-48cb-a686-badec16da1d8,15d3d2d7abacbd366d7b688278bd6033099f7907dd051b11d65554bd39b6fcc2
,88,ade-party-girl,ade party girl,The life of every party.,Female,hair: brown; eyes: blue; teeth: gap-tooth; clothing: one sleeved blue top; accessories: none; expression: scary; strength: adventurous; weakness: impulsive,7e3db30c-9faf-430d-ab48-b854fe0456b9,661bfa0b6697cfb3ac141b3e6db8279d04f46582f7f08dce7b0eac59df4e2602
,89,john-casco,john casco,A very observant person.,Female,hair: black; eyes: blue; teeth: none; clothing: one-sleeved ankara top; accessories: earrings and necklace;  expression: shocked; strength: unpredictable; weakness: loner,2eff88ef-5bc2-4779-917a-533e952e2953,4d9713ed1077888497bad7cde1df8ee118bf089f0f7dcab73633a86011d8c6f7
,90,agha-uwa,agha uwa,A woman of high social class.,Female,hair: brown; eyes: blue; teeth: none; clothing: ankara top with strap and full sleeve; accessories: earrings; expression: sad; strength: daring; weakness: loner,8478a002-1eba-4a05-8b98-7170c6e39254,fd9be7fbc062fa99c0a090586da87cb1fdacf2ff2a0e0abf6c3abee53a335890
,91,udeme-great,udeme great,A lady given to adventures.,Female,hair: purple; eyes: black; teeth: none; clothing: ankara top with blue sleeves; accessories: green necklace and green earrings; expression: clueless; strength: decisive; weakness: stubborn,d1476409-6f8b-4be9-8c93-24d9123749c5,585968dc2a8260307fa41398c7cfd9d6c576cb06de94aac992c6331fb7328a63
,92,femi-tech-bro,femi tech bro,A rookie in the tech industry.,Female,hair: brown; eyes: black; teeth: none; clothing: ankara top with blue suspenders; accessories: green necklace; expression: mischievous; strength: creativity; weakness: procastination,ba3ec22a-13d5-4e19-9b7f-aac764fda28c,cff73b929f62891841f5ff6bb88bfa9771e8558d642f298d3f713afa21fb686e
,93,sai-baba,sai baba,A leader of a third-world country.,Female,hair: brown; eyes: black; teeth: none; clothing: off-shoulder ankara top; accessories: earrings and necklace; expression: anxious; strength: trend spotter; weakness: distracted easily,fdfff369-5b57-4612-9f89-f5d408f24a35,976cbfeb80dd5ab06d9240479f9fad992a30266c368cf6f0593750c57a07df65
,94,omo-pastor,omo pastor,A devout christian.,Female,hair: brown; eyes: black; teeth: none; clothing: spaghetti strap ankara top; accessories: green earrings and green necklace; expression: happy; strength: happiness; weakness: too emotional,49e09559-61a6-41ff-811a-272721a7475c,001b54dc6971275ac6c3fd2e69762667ef59d140109f95d0d4d8511e06929265
,95,obi-container,obi container,A rich South-Easterner.,Female,hair: brown; eyes: black; teeth: none; clothing: animal print top; accessories: green necklace; expression: surprised; strength: wealthy; weakness: risk taker,4b64cf48-94fa-4aed-8cf2-452974b48ee3,1a974f7b8c63d24519cb069606262b851e6b736768a3def17c984985c4712b66
,96,erigga-international,erigga international,Superstar from South-South.,Female,hair: brown; eyes: black; teeth: none; clothing: half ankara; accessories: green necklace and red scrunchie; expression: curious; strength: talented; weakness: overconfident,3ac39a5e-7b0c-4371-b0c8-7cb4b68aed2c,35457566c00c36287a960daffa29039dcd7f85002daed974e99aea8eb4989cfe
,97,ayo-web3-bro,ayo web3 bro,Someone with no actual knowledge of basic computer principles.,Female,hair: brown; eyes: blue; teeth: gap tooth; clothing: sleeveless ankara top; accessories: green necklace; expression: terrified; strength: tolerant; weakness: illiterate,c137ec2b-18cd-4c29-a194-af29ac9e6c1c,c7ab3f18a664ccf0fd520af5d7864b73ae97b37ac8097af8c01324199ac07d56
,98,phoebe-queen-bee,phoebe queen bee,A self-centred woman.,Female,hair: brown flowing hair; eyes: blue; teeth: none; clothing: ankara top; accessories: none; expression: blank; strength: attractive; weakness: gullible,1277e9c0-81dc-4747-89df-a9d2ae4fcf96,8858fffea25d5de2bca71a629a189f873bc776157f5f0a7f60648b113992cec4
,99,rachel-warri-babe,rachel warri babe,A highly disciplined woman.,Female,hair: red braids; eyes: white; teeth: none; clothing: yellow danshiki; accessories: none; expression: blank; strength: assertive; weakness: talkative,19e6af3b-ef2d-46ba-ba05-59fb612ebbee,450e6788a2241f4da36aff22eab9777080e3fe0ee60cf8852b7ef798c7b0ab5d
,100,adun-preacher,adun preacher,A religious woman.,Female,hair: black short hair; eyes: blue; teeth: none; clothing: blue paisley print blouse; accessories: ankara bonnet and hookah;  expression: blank; strength: bold; weakness: fake,cc4dfedf-c343-48db-ad67-e39452ec2380,d5266e51628a30ebbaa5ddaa8132cc2a7a3322c1d8cb435525043f20984294eb
TEAM CHISEL,101,adebola-omo-oba,adebola omo oba,Adebola loves soft life with her fathers wealth.,Female,hair: brown; eyes: opened; teeth: white; clothing: ankara print; accessories:none; expression: staring; strength: bold and outspoken; weakness: pride,fbf43611-f267-4cba-bf4b-a3ffdc122589,6e0e10fd1a1163b5ccfcd1a856ef744bc180fb21542a15260e919c655523999f
,102,chichi-the-dancer,chichi the dancer,Chichi loves dancing and party.,Female,hair: black; eyes: blue-opened; teeth: none; clothing: ankara print; accessories: none; expression: shocked; strength: dancing; weakness: lovergirl,e7c32b06-7022-49b4-bbe5-81e8c1d58583,30e6308af9adeff3428e78cf9d7046f8a5fdd1c710ab2ef1dcd3b8d9aa533267
,103,hammed-the-farmer,hammed the farmer,Hammed owns a farm with his family.,Male,hair: none; eyes: opened; teeth: none; clothing: brown and cream buba; accessories: nose mask; expression: innocent; strength: farming; weakness: drinking,e57d8985-599e-49da-8d62-fc16b7ac93f2,0b39f0939d768a6f8deef7c92c1b6e7a6fb68be98f516219259ce8bcf007f159
,104,farida-the-tivlady,farida the tivlady,Farida is a beautiful Tiv woman.,Female,hair: brown; eyes: opened; teeth: none; clothing: ankara print; accessories: lipgloss; expression: cool; strength: cooking; weakness: multitasking,31d3e229-003e-43c8-ba82-38f49cf58ccb,20579151ec1f76c276d0dd13992d0d16637e9d27dff96bf4d8e915588b9b9c80
,105,hannah-the-singer,hannah the singer,Hannah loves singing and belongs to choir.,Female,hair: blonde; eyes: opened; teeth: none; clothing: flower print dress; accessories: earrings; expression: angry; strength: singing; weakness: reading,281f5bd7-5282-458b-9811-e369980e7dee,50ae4811998aa9c2048fe0fcaecb0ad262dd4f288b664797fbb9ffbf00473f21
,106,nonso-the-igbogirl,nonso the igbogirl,Nonso is a hardworking Igbo girl.,Female,hair: black; eyes: opened; teeth: none; clothing: leopard print blouse; accessories: none; expression: happy; strength: business; weakness: spending,5cfa76df-8376-4505-af12-78af24f108d6,716b35f633a2bd9b598c58985fba5603aef008ed090d0981beffef1bbbd20128
,107,shade-olori,shade olori,Shade loves soft life and makeup.,Female,hair: black; eyes: blue-opened; teeth: none; clothing: ankara print; accessories: none; expression: none; strength: makeup; weakness: sleeping,1a07ca73-d39b-43e9-a0f1-ef9f5e57d3a9,ef3939a8c30843addce6ca1a68c774143ef28e0f87f9cd42fa48d284f351fb9e
,108,quadri-the-teacher,quadri the teacher,Quadri is a devoted teacher that teaches mathematics.,Male,hair: none; eyes: opened; teeth: none; clothing: yellow on blue jean; accessories: nose mask; expression: none; strength: teaching; weakness: talking,d96a93e7-17a4-4efe-b09b-02185cc81ce8,ee4fdb84b8980a5e7f013133162e58d323304d8b9a2a733f58138f891c75d8a6
,109,Ifeanyi-the-dj,Ifeanyi the dj,Ifeanyi is a music dj that performs at events.,Male,hair: none; eyes: opened; teeth: opened; clothing: animal print; accessories: red cap; expression: none; strength: mixing songs; weakness: none,030f665d-2cd7-4376-aef5-4030dad9f2d6,f751ed295ea1a546eb0e2b52b09e9abc65fe04e446f6841d73a24ed8e32e7949
,110,fayo-the-yorubademon,fayo the yorubademon,Fayo is a yoruba demon with excellent communication skills.,Male,hair: bald; eyes: opened; teeth: none; clothing: africa print; accessories: mask; expression: none; strength: determined; weakness: steals,e270e278-a9b5-408d-b527-d518239a997b,ea09a52ac1c56a9a612be5c3cf09b9b6cdf23d7c7712018cd307c82c6aaf3655
,111,nkechi-the-actress,nkechi the actress,Nkechi is an international actress that acts in hollywood.,Female,hair: purpule short hair; eyes: opened; teeth: none; clothing: native print; accessories: smoking; expression: rugged; strength: love; weakness: lie,34b1136d-00b1-4f29-8a03-5b02291d47d5,315bd50dc62f77604fb42033090ecb70a6fe34da3fbe6f496aebc081bf8cd017
,112,hamzat-the-mallam,hamzat the mallam,Hamsat is a mallam doing burea de change for a living.,Male,hair: bald; eyes: opened; teeth: none; clothing: wrapper; accessories: none; expression: straight; strength: traditional; weakness: diabolic,592eff9f-93b2-4452-a2ed-5d44ebc969db,dda6a4cd8f5b598eb9a698991ddb81050c65c47a6ec3a7d6f4e26f340265655c
,113,nnena-pretty-girl,nnena pretty girl,Nnena is beautiful girl that loves to talk about her beauty.,Female,hair: brown bob marley; eyes: open; teeth: covered; clothing: african print; accessories: sucker; expression: none; strength: giver; weakness: possesive,d9477612-ad63-408e-8d12-24679c647b32,c663e0e5e3f41cdda2d4b906c3f3cc1ee22dea5ce2cf2d67028092baff147489
,114,tunde-the-boss,tunde the boss,Tunde is a boss that loves to take charge at work.,Male,hair: capped; eyes: opened; teeth: white; clothing: native cloth; accessories: none; expression: none; strength: cooks well; weakness: bossy,7635c4ee-04f6-4872-bfc9-37e5a73c8fc6,9e1db59300344b75392d67eb66dbeacc2a4afdfc368c9fae45650ed2705675b9
,115,nnamdi-the-barber,nnamdi the barber,Nnamdi is a barber that devotes time to perfect his craft.,Male,hair: brown afro; eyes: open; teeth: smokey; clothing: africa print; accessories: none; expression: none; strength: determined; weakness: loves clubbing,152758f3-9414-45a2-a809-95cb05a3de13,bf40819d4fa67e02e13febd3f45a23b11e0340c1791d6a186925e0a8a340f0da
,116,amaka-the-hypepriestess,amaka the hypepriestess,Amaka is can never be intimidated no matter the circumstance. ,Female,hair: black hair; eyes: opened; teeth: open teeth; clothing: africa print; accessories: none; expression: laughing; strength: independent; weakness: insultive,c7726e84-3c5c-4e66-8677-cbfb5c9ee850,f77edaae972d9f53eb26b02f13ea1e48317f3c8ef3f52d12fb1a05b1ed12e2f0
,117,kemi-foodie,kemi foodie,Kemi loves food and can also prepare good meals. ,Female,hair: black har with scarf; eyes: partly opened; teeth: none; clothing: one hand style; accessories: none; expression: none; strength: can cook very well; weakness: dirtiness,3116cb6f-14c4-4d5a-af57-54253b72a309,46e2dc9e31d3440339d7bf665f6752ef5a965d73e63866ae9c70743fbd3b63a2
,118,ada-the-fashionister,ada the fashionister,Ada loves fashion that she rarely repeats cloths.,Female,hair: brown afro; eyes: glasses; teeth: white; clothing: africa print; accessories: none; expression: smiling; strength: successful; weakness: too serious,a14df1c1-7a5a-4a33-8780-0fb01c593da6,1ab72981214bf827a782013da8c11d0bd1790e6e3d92b4fab15b02d72fe9ad6c
,119,kayode-the-baller,kayode the baller,Kayode loves life and lives it.,Male,hair: bald; eyes: wide opened; teeth: none; clothing: yellow on jeans; accessories: none; expression: none; strength: swaggy; weakness: loves women,fe17bfdc-c251-4654-8313-1ab793e11748,15be3b0af57dc8a81626c2866cd381d5b3b86fc00b4db48b9b77f9fde36efa57
,120,kola-of-lagos,kola of lagos,Kola is the life of the party everywhere he is.,Male,hair: bald; eyes: opened; teeth: none; clothing: native; accessories: none; expression: none; strength: intelligent; weakness: shy,df295be1-1509-406e-a263-28a5dee0abca,04a78cf1c160acef4c0c3624c095dbb142dcd3f5642ee9ec88fe10dddd3c3cb9
TEAM BRAINBOX,121,azikiwe-popular-trader,azikiwe popular trader,Azikiwe is a popular trader.,Male,hair: none; eyes: blue; teeth: none; clothing: purple and yellow; accessories: cap; expression: happy; strength:strong; weakness: shy,7ebde325-8efc-4997-811a-b5686269929e,7b89951d54aeabc21ad56e4b036f4fdf6d37e5a6fbf0a7a7d5761489a585ee1e
,122,obasanjo-funny-guy,obasanjo funny guy,Obasanjo is such a sweet guy loves by all. ,Male,hair:none ;eyes: black; teeth:small open teeth; clothing: sleeveless yellow ankara; accessories:none; expression: serious face; strength:mild; weakness:anger,c136a120-a339-4080-96ca-1c93845c5848,43d105ba973b407c9d95b3fd7064eb3ea2a043d95593fe1947b0517357f355b7
,123,yakubu-village-chief,yakubu village chief,Yakubu is the best village chieftain.,Male,hair:none ;eyes: blue; teeth:open white teeth; clothing: black isiagu; accessories:cap; expression:happy; strength:strong; weakness:impatience,5b0c0d26-d204-4264-b579-081ff9df935b,be93da8b89057eb2d1082002b28d37f994c98b8995c72be0909ea8b599d65915
,124,abacha-loves-smoking,abacha loves smoking,Abacha loves taking cigarettes.,Male,hair:cute braided hair ;eyes: black ball white eye; teeth:none; clothing: mixed colors ankara wear; accessories:none; expression:happy;  strength:strong;  weakness: anger,8ac6d95f-0cf3-4f54-9cf2-be8834b3004c,64fc9ce12db135d455f21b52dc8404cf2129adb31a3c09cdbe873dfaefc3bb84
,125,johnathan-good-leader,johnathan the humanitarian ,Johnathan is very progressive young man.,Male,hair:punk bearded man ;eyes: closed; teeth:none; clothing: white shirt and senator; accessories:cap; expression:bone face; strength:strong; weakness:pride,241e3713-4ce3-48d0-827f-b282ae2db6c4,e7e4421809ec410260df4a258ea94364d8b9fcf3565a4497b97ae9d3dc85e132
,126,johnathan-genz-kid,johnathan genz kid,Johnathan is zealous young man.,Male,hair:none ;eyes: blue;teeth: white; clothing: yellow ankara wear; accessories: traditional cap; expression:happy; strength:strong; weakness:arrogance,90c0ae09-a35f-42ad-b93c-dcf30169acd9,4ef7cf86d84ba0711054d1e1fe87db8af9dbe3be2a16560da422e6636e15c2a3
,127,eddy-the-community,eddy the community leader,Eddy has so much positive energy.,Male,hair:none ;eyes: blue; teeth:none; clothing: black isiagu wear; accessories: cap; expression: happy; strength: strong; weakness:emotional,5cabf9d9-882b-459e-9253-8c07eb045e2d,35b63533d22f13260fe9ff6a281528b6cfd9411fb03a2ecef701431d88b72d32
,128,olu-the-oba,olu the oba,Olu the great ruler in our land.,Male,hair: purple braided hair ;eyes: black; teeth: none; clothing: mixed color traditional wear; accessories: none; expression: serious face; strength:mild; weakness:anger,04c4b28a-aca0-44b1-a064-ed0d9d2a31ca,b5e51e8ec9b59b081a27c23d30bdd520f251050287b92fcb43e216311286bc6c
,129,edu-the-biggest-trader,edu the biggest trader,Edu is the biggest merchant in west coast.,Male,hair:none ;eyes: blue; teeth:closed; clothing: black and yellow collar native wear; accessories:cap; expression:happy; strength:strong; weakness:impatience,48d1de5f-5f3f-46aa-b2fd-68420a8e802b,36dd8e5f53348f6eff0d4f27164b125e0a9dacc9d27b15218d79d4ac5c70946b
,130,james-importer-and-exporter,james importer and exporter,James is the sole importer and exporter of spare parts.,Male,hair:none ;eyes: blue; teeth:none; clothing: purple and yellow; accessories:cap; expression:happy; strength:strong; weakness:pride,22541251-022f-480c-8c1e-cf754dce16d6,d7466e51643776ef33616a92f23eb989e700ef744aec4e484a39b5ce4b65a6a7
,131,lanre-the-dreaded-guy,lanre the dreaded guy,Lanre has a great reputation.,Male,hair: none ;eyes: none; teeth:white; clothing: ankara; accessories:cap; expression: happy; strength:strong; weakness:anger,66a054cd-5541-4000-98aa-8f2e9892d880,d82666d2f26d0a96f605d8369178c052a4ae007b943e0d8c36578db255728552
,132,olamide-the-street-boy,olamide the street boy,Olamide has a sweet voice.,Male,hair:none ;eyes: white; teeth: none; clothing: green and blue; accessories: cap; expression: serious face; strength:strong; weakness:stubborn,d50a35b1-b42e-4e0c-8dd8-9b892b56d371,27dd049433c475591b3c4c21db33ba0cf7f87f7d8180e92552246423f4150c3b
,133,uche-peace-loving-man,uche peace loving man,Uche man of peace and discipline.,Male,hair: yellow ;eyes: blue;teeth:none; clothing: yellow; accessories:none; expression:happy; strength:strong; weakness:emotional,6c9d6eae-2ea2-468c-a2c8-928aaafc084b,34cc032f191d82f905fc0ea03b9e4401b8f666553dea83722d6939db74f91070
,134,dave-the-tech-bro,dave the tech bro,Dave is a web3 enthusiast.,Male,hair: none ;eyes: none; teeth:white; clothing: none; accessories:cap; expression: serious face; strength:strong; weakness:none,c0857b11-bf0e-46a4-9108-b8eb93d83e74,8de1714a74424230c6dd440842057f1fc1eb1b4c472e1db278fbd6b6eae71996
,135,obi-the-biggest-humanitarian,obi the biggest humanitarian,Obi loves service to humanity.,Male,hair:none ;eyes: blue; teeth:white; clothing: brown; accessories:cap; expression:happy; strength: strong; weakness:none,201a408c-7a2e-42d9-a62c-0136c885c211,44b59cf25c2b839a819243b55b21341ebe362750d19d47f690a04db70d47b6c4
,136,precious-the-emotional-girl,precious the emotional girl,Precious is soft hearted and sensitive.,Female,hair:none ;eyes: white; teeth: white; clothing: yellow and blue; accessories:cap; expression:angry; strength:strong; weakness:none,b6a41ff1-51ce-42f7-9933-85d0a22ced68,971a6896184f7f8b4a40cd61aa8789fb40d7c727e4925503f1de3c2cd7712c1f
,137,ella-serious-minded,ella serious minded,Ella a dedicated young lady.,Female,hair: none ;eyes: white;teeth: white; clothing: black and yellow; accessories:cap; expression:happy; strength:strong; weakness:none,04036447-f43e-4bfb-9503-f55c9064b14e,25efe25743263e1cae52ba61dca8f5bee23d0119b82e1a6582e9b0dc3bbdb64f
,138,cynthia-cute-eyes,cynthia cute eyes,Cynthia with priceless cute eyes.,Female,hair:yellow ;eyes: blue;teeth:none; clothing: blue and yellow; accessories: none; expression: serious face; strength: mild; weakness:pride,5d12847b-6d71-4691-8337-2e6ef3e283b2,59c6a379d57eafd2c67f4112e14375f7b03063b9afcd82d52112291bae8c5a85
,139,mary-with-hair,mary with hair,Mary with her beautiful Afro.,Female,hair: none;eyes: none;teeth:none; clothing: casual ankara; accessories:cap; expression:scared; strength:sensitive; weakness: fearful,98035e8b-6540-4464-8a3c-fdac9f07b168,7b6b35ae53496c4c927199f7281b5f6d5546378c895b90b7bf7d582b3f22ec80
,140,ada-chewing-bubble-gum,ada chewing bubble gum,Ada always chewing gum.,Female,hair: none;eyes: none;teeth: white; clothing: traditional wear; accessories:cap; expression:sassy; strength:decisive; weakness: insensitive,15309dc5-e483-4658-b503-db85ba2c1722,10fba7c878774007bda5a3e53fc643174db5d7791d74c1bb8d98fcf0ec7ad822
TEAM PLUG,141,viganem-the-drummer-girl,viganem the drummer girl,She is known for typically playing the drum for 5 hours per day without a break.,Female,hair: none; eyes: none; teeth: none; clothing: ankara with drum patterns; accessories: none; expression: sumg; strength: none; weakness: none,5a5a6f5c-39f3-4beb-ab74-60d3c7a90fd4,04d91f85d791bd225faaebad0f17b787a6f7ed74c5b2575395fd116fcb6a0448
,142,lenusuka-the-big-woman,lenusuka the big woman,The lady that loves spending money and buying everybody asaobi.,Female,hair: purple; eyes: none; teeth: none; clothing: black and blue ankara; accessories: none; expression: serious; strength: none; weakness: none,e564a43a-ef77-487d-a88e-749d20a09fd8,7128944c73378f018e1b9aff78071ddc1d06d6c73c27cb2b15b63dbaabc61a0e
,143,enepua-the-clout-queen,enepua the clout queen,The lady that travels all day and enjoys snapping food at restaurants.,Female,hair: purple; eyes: none; teeth: none; clothing: black ankara with yellow and blue gear pattern; accessories: none; expression: chill; strength: none; weakness: none,6dc7e452-0626-4f4c-a28c-f5db3532e305,5eb6c60e0d974183434080720cb1966f514ee652fbf92f45906d2391e9529520
,144,usifong-queen-of-mushin,usifong queen of mushin,Changes her hair every 2 weeks and cannot finish one pure water.,Female,hair: brown afro; eyes: none; teeth: none; clothing: black ankara with yellow peach and blue gear pattern; accessories: none; expression: unbothered; strength: none; weakness: none,221263d0-8775-49f8-bbf8-4b08b49e1482,d391f90900e8a06ac2b78d7ad9893a4a64f29b8de5a323d28b627b410c96ddad
,145,akinyim-the-clown,akinyim the clown,"The most interesting christmas clown, known for dancing in prisons and hospitals on christmas eve.",Female,hair: burgundy dreadlocks; eyes: none; teeth: none; clothing: kente blouse with asymmetric neckline; accessories: none; expression: off-standish; strength: none; weakness: none,c1070dce-48a1-4ae8-b9a4-d070859a8377,50b32f071ef9cdf188444cc5e1d1eea7e4859d11d1dfef27f46d75100e1aca8e
,146,zawadi-mr-sleep-everywhere,zawadi mr sleep everywhere,Likes sleeping in the weirdest places especially in clubs.,Male,hair: brown; eyes: none; teeth: none; clothing: kente agbada; accessories: none; expression: goofy; strength: none; weakness: none,c22489fe-574b-47f3-9667-c9c798b2d4df,24e1cf8dd5e9a659faa261c6adb72907e525b17a7cc3f951988a370425932ecc
,147,chepkirui-mr-self-love,chepkirui mr self love,Likes taking care of himself and spending on himself.,Male,hair: burgundy; eyes: none; teeth: none; clothing: black and kente patterned agbada; accessories: none; expression: sleepy; strength: none; weakness:none,1a91e778-d214-476b-a667-94e9ecb8b5ce,ecb7c8d69cdc6c5e7ffc37fdf1a35f10f14c952a33470f775ed44f775aec4ed6
,148,naserian-the-fear-fear-dancer,naserian the fear fear dancer,A timid and dancer who is always afraid of a large crowd of audience and yet his dance moves can raise the dead.,Male,hair: face; eyes: none; teeth: none; clothing: yellow and blue ankara; accessories: none; expression: warm; strength: none; weakness: none,8177cf38-8284-4eb4-b19c-04473bcb3b5e,7ac7ab3e8e7ed12ff03d55d98d853a7f50708f7f4a416b7ab995935ce0767206
,149,wawuda-the-ashawo-of-africa,wawuda the ashawo of africa,Brags about his body count and follows skirt anywhere.,Male,hair: blue; eyes: none; teeth: none; clothing: green top with blue overalls; accessories: none; expression: fear; strength: none; weakness: none,0554bf35-f588-4009-aafc-ef875b878c29,161fbfa59f9c6372ab6a0f05997392d999c44b64eef56951c3b05aac44f6755c
,150,kerubo-the-igbo-smoker,kerubo the igbo smoker,Loves only his igbo and is happy when he finds an old blunt.,Male,hair: brown; eyes: none; teeth: none; clothing: brown shirt with dog pattern; accessories: none; expression: smirking strength: none; weakness: none,33ba8e73-7949-4bc7-ba27-37ee1d573946,01b17da615210d2c4a89f005204f520b8de94d3d9bee57c08005eabc04f122cc
,151,rehema-the-olodo,rehema the olodo,Failed primary 5 eight times and like playing football after school.,Male,hair: teal; eyes: none; teeth: none; clothing: purple shirt with yellow accent; accessories: none; expression: euphoric; strength: none; weakness: none,1fb33783-4898-48cf-8a73-f81afc71e1a8,f5a08c45eb4815f14db21a97d0188cca0b8554d4bf4d8b68b94cb69978444aed
